sentence,label
alternative would revolutionary principle example state appropriate wealth administer directly,1
hero zero simple explanation change approach,0
city course important factor,0
today every state impose gasoline tax thirteen make use taxis tobacco cigarette,0
want draw attention systematic discrimination lack political resolve issue community face say tolerance increase serbian capital less beyond,0
may less effective firm choose spend,0
battle set economic machine motion emergency take new form require new tactic time time,1
number percentage gdp accord goldman sachs,0
this be the income tax alone,1
instead invest profit worker rail infrastructure carrier spend dollar number billion stock buyback since number,0
court get control believe whatever want curt levey president committee justice tell supreme court state new mexico decision strike political legal,0
figure national industrial conference board percapita cost government separately state numbernumber federaldollar numberdollar number statedollar numberdollar number localdollar numberdollar number,0
personally dedicate career exactly type policy change remove barrier economic mobility stability immigrant family across state say,0
majority coverage restrain factual even positive,0
post question think unreasonable think number million infection past three month could happen winter,0
top buying agent tell access number gain know right people,0
enormous increase public revenue war carryover wartime taxis,0
james file criminal referral federal prosecutor separate tax fraud referral irs along lawsuit politico report,0
number american economic review publish influential article entitle grow like china,0
could increase spending help bridge financial gap suffer low level government,1
tentative agreement allow worker take unpaid sick day without lose attendance point though still know exactly many,0
however mihailović remain defiant say far right win,0
follow necessity certain function government assume example wisdom know crisis crisis know liquidation go far enough price low high enough many bank failure constitute crisis bank many railroad failure constitute crisis railroad credit,1
everyone know that impulse,1
china contrast stateowne enterprise localgovernment financing vehicle invest infrastructure civic project borrow eagerly china bank government behest,1
two category problematic behavior unlawful conduct act involve dishonesty fraud deceit misrepresentation,0
paltry fund follow twelve missionssome contain specific aim reduce rate homicide nebulous like increase pride place ,1
speculation instead tell new deadly terrible vaccineresistant variant even five shot stop,1
raise great concern stakeholder capitalism matter define proponent eager strengthen link democracy capitalism time instead assiduously disentangle one,1
society endow shareholder corporation extraordinary gift ordinary person enjoy limited liability,1
suppose it,0
may drop levelling  part phrase etymology show real preoccupation tory party prevent redistribution wealth  public redistribution require invest across uk,1
be this predictive programming,1
wednesday federal reserve decide raise interest rate number percent make third superhike one june july,0
level administration mean challenge regional inequality recently come use talk inequality general,1
lack avid borrower blunt china monetary policy much big economy global financial crisis,0
torrential spending many arm state leave behind excess capacity skewed pattern production heavy debt,1
mr xi become deeply invest maintain zerocovid regime portray proof china superior social model,0
observe one side governmenteven conservative governmentand side force move effect redistribution wealth downward political theory bind different reason favor popular taxis,0
instead give minister power make decision base whomever able lobby successfully fundraising dinner need empower local regional devolve national government make decision base need citizen particularly relation housing utility,1
trenton example make word taboo,0
spiteful critical comment primarily social medium even shout seem genuine public outcry,0
natural level economic recovery long delay measure would soon fail total ruin public credit,1
say hope change whole region finally push thing forward lgbtq right balkan,0
change licensure rule ground fundamental principle fairness consistent new mexico historical value inclusion diversity culture chief justice c shannon bacon democrat say statement,0
system unbridled profitfocused capitalism use serve perhaps important sanctuary long,1
have the modern circumstance overwhelm it,0
emotional appeal add practical suggestion pay cheap end,0
whole country approximately numbernumber separate unit government,0
sunday antipride demonstrator include biker gang religious group farright nationalist rally capital marriage family demand europride parade ban,0
esg fund often charge many time investment fund nearly indistinguishable without esg title,0
florida numbernumber teacher vacancy accord florida policy institute numbernumber kid start school last year without permanent teacher,0
keep change home two future president around number crack hell around number pretty nondescript mostly latino work class community today,1
truly could overcome use public credit objection ground precedent political theory would long prevail,1
state sixtytwo county sixty city addition number town number village last count numbernumber school district try render efficient service amid diffused identity inevitable jealousy roughly numbernumber independent administrative officer board,1
florida military veteran eligible temporary teaching certificate even complete bachelor degree,0
currently evidence direct question serious scrutiny may merit,1
logistic system become interdependent fragile potential leverage worker increase dramatic level,1
many time look slum dwelling distasteful human spectacle say ought law forth,1
newspaper izvestia brutal towards liz truss treat reader detailed account recognise meticulous planning behind event note pass without hitch,1
however demonstrate russia medium environment work,1
idea current prevail work shall enormously increase power selfextension already inherent government,1
may industry accept responsibility unemployment perhaps government must,1
although putin claim would busy attend anyway one head state along belarus alexander lukashenko myanmar lt general myint swe invite either attend send representative hit nerve,1
plan like nhs one area postwar welfare state neoliberal politician able fully dismantle,0
let look map famously black place compton ca home west coast gangsta rap,0
without major change though pool available teacher could continue shrink leave remain everballoone workload,0
initial draft though bill contain little say level  sense action investment would significantly alter life people across ukthose whose town city infrastructure lack investment london part south east decade,1
new booster injection full mrna technology experimental gene therapy shot set authorize week human trial complete,0
also reveal limit ideological position never really count address regional inequality,1
why be teacher unhappy,0
infamous  beast  biden eight ton armoured presidential limousine got stick traffic gloatingly treat poetic justice,1
everyone pay income tax,1
journalist think ask large part leave behind  place need level  first place,1
economy elimination graft needless waste consolidation government competitive part reform structure limit number local civic unit duplication costly,0
therein lie great irony movement whose core justification need capitalist internalise negative externality action create new negative externality,1
last week request dollar number billion emergency funding fall,0
efficient government less cost per measure fast may extend without produce acute pain taxpayer pocket,1
suit name trump trump organization three trump child donald trump jr ivanka trump eric trump claim fraudulently overvalue asset billion dollar,0
extreme liberal socialist radical perfectly honest hater graft corruption government yet increase popular taxis pretense public benefit one way redistribute wealth downward accord doctrine,1
spender public money never want follower,1
find way reduce cost teachertraining program studentdebt burden could help make field attractive,0
firstly evidently demand price,0
xi jinpe china president li keqiang prime minister come office number several year financial crash unwelcome aftereffect china stimulus effort keenly feel,0
very very racist,1
rise even fast national income fall,0
yet little substance serbia lgbtq people,0
await rebuttal argument something curious happen world great proponent stakeholder capitalism respond surprising claim actually stakeholder capitalism indeed thing plain old capitalism,1
tory may happy spend lot public money pandemic way border corrupt still oppose idea state make targeted longterm investment,1
preach gospel responsibility state administer happiness state would prefer kind state simply state,1
president hoover say taste emergency power government,0
actively try make sure scapegoat drugresistant form monkeypox,1
turbulent world strength bring london back attention global elite,0
fraud massively insane americans,1
regard tyranny extreme minority try impose value contradiction collective moral value society,0
yulin city shaanxi province impose fine numbernumber yuan dollar numbernumber grocer sell number5 kg subpar celery,0
speak governmentnational state city localfrom washington county township borough district exercise tax power,0
mutation r346 see variant associate immune evasion mean help virus escape antibody acquire vaccination prior infection,0
entirely clear banumber emerge possible could recombinant variant,0
idea refuge solution public credit degree plausible often good wistful intention,1
willie carver name kentucky number teacher year openly gay english french teacher resign june cite rise homophobia district,0
idea spread like wildfire community community,1
moreover report white house conference child health protection say unquestionably well policy spend money today help handicapped child help spend many time much tomorrow support public expense,0
brief government shall find way less money,0
job gain robust recent month unemployment rate remain low,0
james  lawsuit seek dollar number million disgorgement defendant well bar trump organization engage new york commercial real estate acquisition five year,0
return extraordinary gift corporate shareholder owe implicit obligation back society namely corporation ought consider shareholder interest broad societal interest make decision,1
demand upon public credit social service difficult resist,1
lastminute police ban saturday europride parade plan climax weeklong programme cast spotlight ongoing struggle equality balkan,0
socialist believe everyone something one shall,0
take refuge public credit cause infection attack business banking industry agriculture entire body private enterprise,1
certainly structure government rationalize could easily much government less money,1
allegedly another new covid variant float around,0
government shoehorn leave unpopular planning reform level legislation speak vacuity define mission ,1
could efficient company know well government spend money,1
rightwe extremist spread lie malicious conspiracy theory medium previous year say,0
accuse somalis donate variety politician include rep ilhan omar state senator omar fateh shukri olow run state representative state rep hodan hassan keith ellison crony,0
diverse bar important want client see represent take case advocate say,0
per capita cost government increase follow number wasdollar number number wasdollar number number wasdollar number number wasdollar number number wasdollar number number approximately dollar number,0
government ever surrender power even emergency powersnot really,1
banumber similar banumber many way carry mutation spike protein protein surface virus allow enter cell,0
numbernumber people expect belgrade parade,0
patient intact immune system really need supportive care pain control often need step antiviral treatment center disease control prevention dr sapna bamrah morris say weekend webinar host infectious disease society america,0
massachusetts cost nearly twofifth state outlay,0
cost social service exclusive education represent onefifth total expense city,0
many rail worker simply another contract could determine whether decide stay industry altogether,0
covid case decrease september covidnumber case actually decrease september plateaue summer month numbernumber case day,0
in what way,0
so I dunno,0
citizen democratic society want executive dollar 10trn financial institution play large role already define implement social value,1
current inflation rate sit approximately number percent cause stark increase price grocery utility especially electricity report npr,0
numbernumber teacher quit maryland school number baltimore school number vacancy,0
borrow money problem detroit debt,0
presumably since woke state chief justice democrat c shannon bacon fellow justice hellbent let illegal alien practice law illegal unethical conduct flow illegal alien everyday act aim escape detection authority falsely appear legal alien steal social security number document impersonate people prevent admit bar,1
write french people suppose weakness live long crown everything,0
strong case stakeholder capitalism,1
spirit move oldage pension improve poorhouse,0
commitment government make seem start slogan policy reverse engineer,1
funding exist patchwork devolve regionalcity authority require compete pot rather tax base power need,0
but there be the specious point again,0
next variant evade vaccine,1
must rise government one thing liquidate deflate time economic depression,1
central mechanism process introduction national development management policy  ndmp would override policy make local council lead decisionmaking particular site controversial subject public debate deliberation however limit,0
covid continually evolve become immune evasive accord ray omicron spawn exponentially,0
why be teacher unhappy,0
observe time prosperity government bind extend revenue plenty always purblind demand special benefit confer public credit,1
or at least so I argue,0
clique executive meta snap property london since social media giant new king cross office open year far alone,0
look freeway close lot destination like lax dtla port century city etc,0
kristine garina latvian president european pride organiser association say organiser appeal ban court,0
year however country grow like china,0
common certain reaction sight human misery squalor discomfort disadvantage believe curable wretchedness,1
virus one mutation away evade key antiviral drug use treat atrisk patient fda believe,0
number university pennsylvania study find number percent newly mint teacher quit within first five year job,0
china gdp number could dollar 2trn level forecast january reckon goldman sach another bank,0
many teacher say push past point endurance,0
gap open gdp path envisage china start year grimmer one seem probable,1
arizona allow current college student teach,0
new mexico document state license practice law shall deny base solely applicant citizenship immigration status time character fitness standard investigation section law license applicant bear burden prove good character support application,0
chart c show unvaccinated child previously infect covidnumber still prove positive immunity reinfection variant covidnumber injection may number,0
but what of american individualism,1
cost government measure one thing quantity government cost another,1
white house mainstream medium try avoid kind conversation,1
thank deep property slump government zerocovid policy entail lockdown response every outbreak virus economy forecast grow less number percentage number accord bank nomura morgan stanley ubs,1
observe another strange bedfellowship,1
biden administration cap president recent trip michigan focus largely worker right transportation innovation hand first federal grant dismantle highway build perpetuate racial discrimination,0
principle central government could revive growth,1
moreover these force be thoughtless,1
indeed government newspaper rossiskaya gazetarather improbably stand poor neglect head state complain decision force world leader go funeral motorcade special bus  gross violation diplomatic protocol ,1
accord fbi money steal use feed child go various shell company front operate somalis use buy everything porsche african property,0
stakeholder capitalism capitalism necessary popularise term first place,1
look bellwether world economy could bad consider happen high end london property market,1
they be probably right,1
stakeholder capitalism poison democracy partisan politic poison capitalism,1
though detail release appear rail union make limited meaningful gain key issue hold line,0
government serious equality levelling  would look opposite bill,1
government favor naturallythe feather least squawk radical force may nothing else common government favor ground doctrine,1
could cause company ship good truck turn could lead downward spiral rail industry cut already beleaguer workforce,0
and of course he be,0
chart b show covidnumber injection prove negative effectiveness infection among child previously infect covidnumber prior vaccination child infect covidnumber prior vaccination within number number week number month give first dose,0
that be to say we have not consciously intend it,0
recent national conference american association old age security representative connerynumber move oldage pension bill congress say evidence introduce house committee show cost oldage pension would much less state municipality present cost workhouse institution,0
variant scientist name bfnumber short banumbernumber allegedly make number percentage sequence infection last week us accord new datum us center disease control prevention,0
this be notably so in the present,0
university washington epidemiologist ali mokdad predict rise report covidnumber case,0
nevertheless rise irrespective state time continuous,0
increasingly may seem irresistibly use public credit create indigent caste indigence become comfortable many may seem goal great dependent caste refer people low income range without indigent yet dependent upon public credit security modern housing care illness protection health economic insurance amusement guidance socialservice caste mind indigent oversee dependent,1
shall cost government reduce,0
happen national income rise normal,0
skabeyevas thrive atmosphere conspiracy xenophobia,1
certain national group particularly field education recreation health sociology set percapita target toward assert every city certain population range aim,0
even discussion see clearly go,1
planning system initial institution aim democratise land planning act number define local authority responsibility set development plan decide develop persevere,0
mrna injection completely degrade human immune system vaccinated population worsen week,0
two child every nine far handicapped physically mentally need special treatment training,0
already ten year age gainfully employ whole country male female one ten directly employ government service,0
appear extremist get way,0
detail come rank file discuss agreement cast vote,0
one express timid doubt regard necessity project expense booster argue public demand matter fact originate scheme taxboosting influence emanate per capita model standard,1
predict evade immune protection vaccine natural immunity,0
leftist also fond invoke magic euphemism make social problem create go away,1
or a doctor,0
state also invade field consumption taxis formerly use almost exclusively federal government,1
but this week bfnumber surpass it,0
china leader may seek avoid past mistake even mean also forgo past success,0
projection far indicate rate number percent end number post continue,0
use code advance agenda conceal actually try,0
suit result james  yearslong investigation trump real estate dealing bloomberg report formal complaint state fraudulent activity approve high level trump organization include mr trump,0
