sentence,label
thus government responsibility oldage security child life tonsil widow backward mentality employment insurance well maternity public nursing recreation adult play plumb housing right nurture infant feeding vocational guidance use leisure everything good life everybody responsibility state procure provide superintend,1
thus bad time like proportion total national income absorb government rise special manner,1
present reconstruction finance corporation revival power time peace,1
tabloid komsomolskaya pravda run largely neutral article albeit overegged headline hardly unknown west give reporter columnist rarely get choose title funeral elizabeth ii racist scandal prince andrew tears corgi farewell mistress ,0
event organiser envisage celebration new progressive era turn chaotic nightmare,1
obviously continue direction without consequence either disastrous fact revolutionary principle,1
huge study conduct several doctor scientist university north carolina north carolina department health human service,0
somewhere inbetween optimum point although never see discussion would fall,1
minute chicago city council may 12th last perfect example commonly regard public credit,1
strike interesting chief justice issue statement levey tell another article,0
how be local government cope,0
anything tend directly indirectly get government business lead state ownership mean production,0
normally majority opinion would speak decision really policyour state value inclusion diversity ruling base policy definition judicial activism,0
say risk violent backlash grow year,0
recombination happen two different variant sarscovnumber virus cause covidnumber infect person time report ndtv,0
competition embarrassing unscientific common point view government seek revenue,1
accord twin cities pioneer press ss catering lead qamar ahmed hassan receive dollar number million federal fund,0
california florida illinois nebraska new york wyoming,0
last week us jolt reckon profound implication national freight railroad worker strike,0
importantly development happen among unionised worker unorganised worker form union,0
letter smart congressional leadership last week union say railroad take away member  ability worthy parent dependable spouse eliminate realistic mean employee receive medical service ,0
go along edge black neighborhood separate nearby white community,0
less many analyst expect less require,0
cover story back winter rely important work local reporter like bill glahn american experiment,0
why be teacher unhappy,0
number except period civil war cost federal government meet almost entirely custom duty tobacco liquor taxis number cost state local government meet property tax supplement somewhat corporation taxis license fee death duty,0
basis paradoxical inclination lack personal lack personal come horror responsibility,1
modern russia propaganda state way soviet union,1
anyone stick head parapet claim know world numbernumber month stick finger air,1
one least consider may call biological aspect government like organism instinct growth selfexpression let alone bind destroy human freedomnot might wish could nature less,1
therefore taxis must increase first order provide much public revenue far increase provide revenue,1
country company consumer remain reluctant borrow even rockbottom interest rate,0
leftist claim perfectly good legal phrase illegal alien somehow sinister dehumanizing,1
principal reason point view government universal income tax would powerful restraint upon expansion government,0
what be popular taxis,0
at the top be the federal government,0
increase past year continue rate cost government fifty year hence would absorb whole national income,0
country resilience author argue rest unconventional bustbusting tool disposal,0
tax break firm account big share year stimulus compare negligible role play numbernumber,0
fact rail carrier profit ever push worker breaking point,1
work government either directly state employee indirectly support employee state,1
why,0
far away black neighborhood neighborhood bypass cut,0
chart show vaccinated child previously infect covidnumber prove zero immunity reinfection delta variant decline begin see reinfection omicron variant,0
city resource unaide creditor people detroit could enjoy benefit social service,0
economist call limited liability one man great invention,0
it be another power grab,1
course essentially audience one man president,0
school close door pandemic hit march number teacher little time prepare shift remote learning fitsandstart reopen school follow year introduce host new problem,0
next year visibility year,0
run rondo neighborhood black neighborhood twin city,0
one fight covidnumber like china,1
result medium free free try guess would please audience,0
court make policy decision find go forward lack citizenship immigration status may use deny law license individual possession law degree otherwise eligible join new mexico bar association,0
world influential proponent stakeholder capitalism blackrock chief executive larry fink mean proclaim company need earn social license operate every day respectable view,1
rep ilhan omar make government meal child one signature issue,0
or an engineer,0
trend expect reverse soon next month,0
predatory parasitic less shameless force inseparable government,1
since become popular refrain defang republican criticism esg movement particular,0
indebted stateowned bus company lanzhou capital gansu province float ingenious idea pay overdue salary staff,1
extreme home rule good government,1
brexit appear horizon time rich international buyer avoid london fear complication might arise outside eu,0
write previously government try year centralise planning system remove much space dissent development whether newbuild housing estate shale gas fracke rig,1
number teacher die covid first year pandemic recent survey find number percent teacher report suffer long covid,0
biden got personally involve phone negotiation labour secretary marty walsh convene,0
suppose stress abnormal public revenue structure government somewhat rationalize mean economy efficiency cost government measure much reduced,1
clearly upper echelon state forget president biden intense involvement broker settlement demonstrate,0
ask american federation teachers president randi weingarten,0
estimate tax commissioner state new york write essay community service magazine preposterous duplication part office power government,0
year talk mission leave behind  place red wallall show electoral hot air always plainly nonsense something tory press go along anyway order pretend actually sort plan end stagnation responsible,1
variant also identify several country around world,0
worker would number percent wage increase number include immediate number percent raise,0
railroad worker remind issue work us explosive ignore,1
well case establish certain thing way anything establishedby fact industrial rhythm break crisis employment become function government provide people work thus responsibility unemployment come rest upon industry think belong upon governmentthe stateand must charge public credit,1
effect work social service flattering sense benignity well less fortunate,1
great economic political advantage enjoy result people get coin term,0
 shock jock  like skabeyeva role bring combative energy jerry springer george orwell two minute hate ,1
fbi warrant note qamar ahmed hassan write approximately dollar numbernumber check ss catering bank account amax travel travel agency specialize haji travel package,0
contrary see must extend meet new responsibility,0
pay time sick day perhaps defining issue dispute gain ambiguous,0
new mexico align least eight state allow attorney licensure immigrant american bar association endorse principle permit attorney practice law regardless immigration status bacon say,0
new mexico become late state welcome illegal alien attorney,0
therefore know could happen public credit city,0
other country push on a string,1
everything need know big problem,1
early hour thursday morning white house announce tentative agreement major rail carrier remain holdout union teamster  brotherhood locomotive engineer trainman blet transportation division international association sheet metal air rail transportation worker smarttd,0
unique set circumstance bring pcl back focus safe choice global player seek somewhere stash cash,0
and guess what,1
bad banking wild speculation senseless credit inflation matter cause private banking structure seem fall become function government support public credit particularly save bank save depositor,1
month scientist watch banumber dub centaurus twitterverse variant interest potential surge fall,0
accord report fortune bfnumber make headway increasingly crowded field omicron subvariant,0
public credit belong people whole may anything like,1
monkeypox go cause another lockdown,1
shipper report delay high rate number previous two year,0
fourteen state oldage pension law number oldage security measure pende forty state legislature,0
dr anthony fauci warn likely fall surge early april,0
several side effect namely pcl became mostly line empty property price go trophy  mode,0
district number percent student body nonwhite number percent teacher resign retire last year,0
adoption precision schedule railroading dramatically reduce number worker deliver immense gain wall street,1
would anyone be surprised,0
decline predict last long however combination wane covidnumber immunity colder weather horizon see people head indoor could send infection back,0
also racist black neighborhood number route elsewhere cut black neighborhood something cause racist mayhem,1
creditor hard yes suppose creditor borrow,1
meanwhile johns hopkins bloomberg school public health epidemiologist dr david dowdy say possible see number case similar late surge,0
imagine today everything aggregate without act individual compose aggregate,1
less government see amount government less money,1
monkeypox could mutate antiviral drug overuse accord recent warning food drug administration,0
third formation force move parallel manner absorb national income extension government make practical reformer idealist goodgovernment people without political theory,1
ultra belgrade big football club momentarily put tribal animosity aside run riot across city beat paradegoer fight run battle police leave two officer seriously injure,0
may sound like lot figure less number percent massive annual profit,0
even thing manufacture country whole lot product transport warehouse,0
zombie neoliberalism level already rich,1
take case new york say,0
one work perhaps try another public already sensitize possibility,1
really advocate nuclear first strike,0
local government pressure keep lid infection preoccupation would distract allout effort boost public investment even financing available,1
property slump hurt land sale account third revenue last year,0
europride go warsaw number riga number belgrade seem like natural next step term political complicated,0
beneficiary daca program become attorney state number special rule,0
first thought war itthe war cost war thing veteran  relief pension national defense,1
new attorney admission rule great victory safeguard attorney status even supreme court eventually invalidate daca,0
also left describe everyone touch nation immigration law immigrant whether illegal alien legal permanent resident,1
big police presence pride finally go ahead peacefully number,0
number vučić even appoint gay politician ana brnabić prime ministerial replacement become president,0
national government would able set parameter thisfor example rate social housing emission reductionsa well focus project cut across country like train,0
conservative reject  boris johnson term clearly use positive sense drop reference level,0
plenty people keen diss uk moment factor make britain safe place live work remain steady greenwich meridian trade east west politically stable island strong rule law,1
half total cost government cost city local government percapita cost number three time number,0
nationally percentage teacher quit soar record level july number past year quit rate drop state district shortage,0
theory problematic behavior part new mexico ruling could still prevent illegal alien give authorization practice law count,1
suddenly though multiple prospective purchaser chase one despite recent vast increase cost build,0
would even think pilot,0
predict new variant come food drug administration decide approve experimental vaccine booster human trial specifically omicron,1
local farright activist appear quietly accept defeat belgrade pride tame smallscale annual event ferocity opposition europride reveal social attitude much different number,1
secretary treasury speech refer tell income inheritance taxis levied reach comparatively people income tax popular number percent people pay income taxis,0
nobody can answer that,1
whether oldage pension would cheap poorhouse question even permissible determine matter fact,0
recent report new poor make welfare council new york city reference mental infection dependency upon investigation unemployment relief,0
yet unction undeserved come fact sourness,1
way downtown two freeway take much surface make pedestrianism inconvenient,0
recent event reveal strike even relatively small number numbernumber rail worker could completely upend economy provoke political crisis,0
china withstand year slowdown past,0
isteve commenter sparkling wiggle write highway placement funny nowin situation,0
fiscal deficit broadly define include offbudget borrowing increase year,0
tecovirimat still available doctor obtain patient expand access protocol set cdc,0
still many nation number million publicschool teacher become deeply disenchanted profession,1
fda issue new guidance antiviral drug know tecovirimat tpoxx publish week online update labeling,0
go window since ukraine war begin,1
freeway take increase percentage city surface go outskirt interchange near center,0
late development come week james refuse settle trump lawyer new york times report,0
worker would grant one single pay sick day,0
even  racist scandal  prove rather contrive comparison way african head state force travel bus white gentleman  joe biden could take car,1
state loosen eligibility requirement,0
what should or should not be be a question that belong to argument,0
little way investment power deprive region plan investment creak infrastructure nothing would support new industry across country,1
thought police bidenharris regime order immigration enforcement agency april number refrain use alien illegal alien,1
mean extension governmentnot bad government good bad together,1
total national income fall proportion absorb government rise,0
hilaire belloc book servile state define something else economic status,0
superficial wherein aim abate acute pain taxpayer pocket anyone suppose reduce cost government economy great efficiency limit government elusive crucial point,1
also time new booster shot want everyone get halloween,1
two thing particular show pcl back business,0
court order concur change recommend board bar examiner code professional conduct committee,0
be there more longterm fix,0
boris johnson declare level  define mission  administration practice main usage sloganpolicy pretend government actually something positive alongside various draconian piece legislation attack democracy,1
content levelling regeneration bill prove level rule party interested level bank account already rich,1
realworld datum supply uk government us government unfortunately show exact thing,1
but the risk be real,1
loss public credit complete ruin would least consequence,1
everyday citizen western democracy range america britain correctly sense something amiss,1
mean first time uk right develop land public matter rather one confer private ownership,0
see camp ultimately triumph tell much far putin really plan drag russia outright totalitarianism,1
last year california colorado ban phrase illegal alien state law,0
first habit one think traditional image machine boss pork barrel spoil system politician everywhere popular character acquire merit power spend public money thing people money people take care time enough everybody money,1
total ruin public credit would disaster fact,1
price increase also see good service directly affect pandemic war ukraine could sign inflation longerterm problem,0
way outskirt average resident inconveniently far freeway,0
far cry rail union  original demand fifteen pay sick day,0
glahn american experiment find feed future number authorize site program approve maximum numbernumber child lot hungry somali kid,1
and we shall have do another thing,1
state shortage also far difficult find teacher math science special education class,0
all the public treasury will be rich,1
usually politician use open newspeaktype term try obscure want say,1
ask question one might tackle regional inequality answer almost always involve longterm state investment often lead local regional government devolve power funding,0
white house official tout effort cut paperwork order get drug socalled compassionate use channel,1
theresa may make explicit socialism level,0
particular kind state sacred particular doctrine wealth dangerous go road theory either kind state lead shall status private wealth within,1
sign financial strain confine ledger book,0
visibility increase progress belgrade,0
bizarre new mexico illegally subject arrest deportation yet time could represent lawyer another illegal alien face thing,0
tolerate give encouragement everexpande cost government,1
security accord economic status person class group place freedom,0
why be teacher unhappy,0
much potent force act upon definite political doctrine,1
trucking shipping company slowly recover supply chain issue cause covidnumber thing get bad rail,0
international alliance theatrical stage employee iatse worker attention country almost go strike unsustainable work schedule similar rail labour dispute,0
first start write rise stakeholder capitalism corporate americaand close cousin esg environmental social governance movement capital marketsi explain term mean new concept audience,0
bernie sander point testimony congress would cost rail carrier total dollar number million per year fulfill demand,0
go middle black neighborhood split community,0
right common variant banumber number percentage banumber comprise number percentage infection banumber comprise number percentage,0
june number nine month toppling serbia autocratic president slobodan milošević serbian capital belgrade attempt host first pride parade,0
either way say public gathering kind would go ahead saturday,0
taxpayer willing sake immediate relief increase load come next,1
that be what it mean to sell bond,0
mean tax mindful wealth favor increase popular taxis aid defective child,1
evident way taxation reach point represent active redistribution wealth hand power government,0
another analysis official uk government datum conduct team expose find mortality rate per 100k low among unvaccinated population age group take approximately five month elevated mortality among vaccinated realize,0
it a kind of brainwashing,1
mitic say dveri member human right antidiscrimination law protect lgbtq individual workplace example oppose promotion ideological homosexualism pride represent,0
arguably damaging rampant increasingly irresolvable cultural discord democracy around world,1
pennsylvania kansas alabama mississippi georgia also report crisis staffing classroom,0
wealthy investor feel fairly confident least grasp happen world economy short mediumterm pcl leave somewhat doldrum,1
give planning system significant redistributive potential take power away landowning elite,0
conservatism be about level up,1
and remember that the pandemic be not over,1
great negative externality stakeholder capitalism one ought internalise return political power nebulous stakeholder back citizen nation,1
reasonable mind differ question debate take booklength work fully adjudicate,1
whether would good otherwise yet point,1
old object animositynamely political bosshas annex idea,1
despite mass medium campaign make believe get booster essential top immunity due decline effectiveness actually impossible vaccine effectiveness wane come covidnumber injection,1
society approach address important social question climate change racial inequity heavily influence dictate corporate chief davos voice everyday citizen public square,1
rise hospitalization mortality high proportionally rise case simply many majority americans right either infect vaccinate immunity say,0
voice count less corporate elite use market power settle political question,1
nonetheless believe fall short legal historical reason lie woke inc book publish last year,1
third fall covidnumber infection death still remain elevate much society return seminormal state child head back school office bustle worker,0
expect surge bad outbreak monkeypox come week,0
actually win expose fault within system reality people power,1
cite example one state state income tax double plus new high federal income tax amount onefifth personal income dollar numbernumber year rise threefifth personal income dollar numbernumber year,0
numbernumber american psychological association survey number percent teacher report physically attack student third report threaten harass,0
and so it go,0
taxis rise point begin devour people possession taxpayer wild relief,1
new mexico high court become authoritarian appear operate outside limit power say state gop chairman steve pearce,0
the intention be to overcome it,0
impressive number charity seem focus somalis minnesota,1
part mean live democracy question determine citizenrypublicly debate privately ballot boxwhere person view unadjuste accord number dollar control marketplace,1
organiser get green light number pride mar farright violence rioting,0
clear original covid shot stop covid would one work,1
of course not,1
insist replenish exist stockpile athome test help meet testing need month ahead put us well position manage potential increase testing demand fall winter,0
structure government strata begin innumerable small local unit boroughs townships school district improvement district one exercise tax power rise thence county city state,0
the senator be only human,1
left aim make horde illegal alien various socalled immigration reform unleash fellow americans year seem normal acceptable,1
money deny feed future complain minorityowne business serve almost exclusively economically disadvantaged child color deny right serve culturally relevant food youth national emergency,0
recent indicator point modest growth spending production fed say,0
number percent number double rate district number percent student white,0
national income dollar number billion year oblige buy government buy national income nearly dollar number billion number moreover depression oblige buy good deal deferredpayment plan,0
denmark germany france see number percentage world identify case far accord covlineagesorg covid datum repository update daily contributor university england scotland australia among,0
know far energy go clear question labour dominate politic year come,0
document note somali eatery claim serve comparable number meal entire st paul public school district,0
story mindblowe sheer scale fraud,1
part due pressure treasury bill introduce new funding,0
one remember southern senator shout loud would steal people hog every time yankee get ham may indignant feeling personal,1
today must explain mean different reason term widely familiar definition dilute great champion,1
poorhouse municipal colony govern idea say magazine new jersey league municipality refuge unfortunate differ people home large facility great number inhabitant,0
nothing bill instead invite put trust whichever multimillionaire landlord former oil executive gets give ministerial position,1
fortune center disease control prevention recently break category case top number percentage dr stuart ray vice chair medicine datum integrity analytic johns hopkins  department medicine tell fortune,0
belgrade choose barcelona dublin lisbon host europride number,0
past economist marvel ability stimulate spending necessary meet growth target adequately employ busy workforce workshop,0
number feed future distribute dollar number million taxpayer food aid fund nonprofit sponsor number shoot dollar number million dollar number million number,0
rule class propaganda outlet announce brand new covid variant move around time autumn,1
recently unexpected organising take place highprofile company like amazon starbuck chipotle,1
enthusiast return home national gathering find city spend less service make business see soon attain standard,1
relate australian covidnumber test kit manufacturer recall numbernumber athome kit due high rate false positive,0
even large response china property slowdown number,0
note chart baseline number vaccinate covidnumber immunity,0
nonetheless clear kremlin impose official line choose secret memoranda call tyomniki circulate medium outlet decide funeral,0
great deal admirable work pay people could afford pay,1
zoom broad view labour dispute one sign grow restlessness combativity among worker,1
key element fraud cry racism,1
addition list number include maine repeal residency provision applicant character reference requirement foreigntrained applicant nevada prohibit denial occupational professional license base solely applicant citizenship immigration status massey say,0
regulator say lab animal study evidence human case family virus suggest monkeypox several genetic pathway evolve resistance tecovirimat,0
apostle stakeholder capitalism convene ski town decry rise populism without recognise populism inevitable byproduct creed,1
ruler prepare accept another lockdown mutate monkeypox virus,1
