sentence,label
reason lack actual levelling  quite clear people run ideology interest conservative party,1
reason protest lightly use public credit save private banking structure tend bring state control credit,0
new england journal medicine study prove effectiveness break number percentage barrier negative effectiveness,0
biden administration predict nearly number million americans get infection fall winter warning number median estimate many case possible especially new variant appear,0
movementa movement within government independent taxpayerto rationalize structure bottom next high stratum impulse absorb power one absorb divide reasonably,0
therefore unprecedented use public credit make propose make meet crisis must soon pass,1
high rate aim slow market likely put pressure many household business washington post report,0
daca thenpresident barack obama defer action childhood arrival immigration amnesty program shield young people come united states illegally deport,0
may anarchy price long justify suppose law supply demand,1
regardless whether tentative agreement approve deep issue rail system remain,1
pictwittercomthb42hdbho tom wenseleer twenseleer august number number far belgium see lion share bfnumber case identify globally number percentage,0
since number say secretary treasury picture materially change federal government adopt fullfledge income tax number estate tax number begin wisconsin number state state adopt income tax though moderate rate today twentytwo form taxation,0
first day schedule event go ahead without incident monday tuesday police issue ban saturday parade well counterprotest,0
less government much government less money,1
never see bad say dan domenech executive director school superintendent association,0
feds stake various feed future meal site find one place suppose feed numbernumber child,0
day city council adopt two resolution one call upon congress reduce federal government expenditure onefifth call upon congress vote government bond issue many billion might necessary spend money make possible american citizen inalienable right earn honest living family,0
study author use countingprocess extension cox model formulate timevarying effect bnt162b2 vaccine previous sarscovnumber infection rate sarscovnumber infection adjustment demographic variable,0
thus responsibility solvency banking whole pass government,0
left want devalue abolish citizenship mean american confer benefit legal people illegal succeed,1
émile faguet frenchman book entitle dread responsibility write like surrender state allow impose even heavy task upon,0
thisthat cost government shall reduce,1
news footage day show group young man march capital chant kill kill kill poof,0
china ruler seem resign slow economy,0
state find hard retain staff poor rural urban district primarily serve student color,0
vaccine effectiveness measure effectiveness vaccine,1
could lead recession coming year federal reserve chairman jerome powell confirm whether recession happen severity,0
yet fast growth money supply far translate equivalent acceleration credit,0
newspaper tv news programme treat funeral straight news story,0
time new taxis invent,0
nobody know lie future,0
limit focus corporate board shareholder  financial interest alone corporate law intend confine sphere influence corporation means protect democracy civic institution corporate overreachjust society confer certain legal advantage nonprofit corporation return confine activity sphere charitable cause,1
impress result yi wen federal reserve bank st louis jing wu tsinghua university write another like china paper entitle withstand great recession like china,0
revelation discovery following may treat cause inquiry board bar examiner determine whether applicant possess character fitness practice law,0
last may go deep,0
union also manage win increase health care copay deductible key sticking point underreported medium,0
say city two freeway build right angle meet middle town,0
urban rural environmental planning strategic longterm process fundamental revitalise region also respond ecological crisis,0
cry racism work peak safari claim feed numbernumber child day,0
assistant commissioner department social welfare report first year oldage pension state new york say protest come mainly people rural district pensioner visible struggle pay taxis oldage pension provide delegate represent correspond work california complain operation oldage pension law state hamper two condition eligible one must citizen good character,0
china have other string to pull,0
like prune tree lustier growth hereafter unless settle public credit principle limit drastic manner ferocious growth government,1
ilhan omar angle mecca angle,0
one american government wartime power war finance corporation,0
hence passion public borrowing,1
creation limitedliability corporation potent tool simply unlock economic gain private sector also stop potentially limitless corporate power could infect sphere society beyond marketplace good service,1
spender one elect office bond issue vote cheerful alacrity,1
bumpy road even juncture,1
china currency also weaken,0
2010s enrollment teacherpreparation program decline third college report far doubledigit decline since number,0
democrats congress try ban alien illegal alien replace foreign national undocumented foreign national,0
illegalalien lawyer allow try prevent fellow illegal alien deport,1
judicial activism come outcomeoriente decision base policy prefer judge judge rather law say,0
increase cost popular government,0
consolidate power hand government expect situation push hard,1
cancellation show necessity host europride belgrade mihailović say,0
clear however pass responsibility government exchange freedom something else yet unnamed,1
yet suppose differently,0
world detail property circulate suppose market  website one control cabal highend buyingselle agent operate completely grid,1
sometime the tide of itself will rise again,0
one guest former general parliamentarian andrei gurulyov man previously advocate missile strike uk time call britain seat evil ,0
number activist defiantly try reorganise municipal authority cancel year year cite security concern claim unable ensure safety participant,0
new policy help blur line illegal alien lawfully present alien citizen long goal openborder leave,1
what then,1
china cut variety interest rate include first reduction benchmark deposit rate since number,0
notion stand sharp contrast shareholder capitalism call corporate executive maximise shareholder return else,0
every minute kid personally beyond tread water mental health say bethany collins quit january eight year los angelesarea middle school teacher,0
exposé real problem new england journal medicine study realworld datum prove vaccinated population immune system return natural state see among unvaccinated population,0
serbia become candidate eu membership number government come pressure brussels prove commitment democratic value,0
conservative manifesto number one least substantial term propose rule party agenda outside one major pledge get brexit ,1
last two year five teacher say nick clark teach high school fort worth,0
well know cow milk expert hand regular manner give milk cow milk haphazard manner neighborhood,0
first piece legislation contain slogan name reach early parliamentary stage recent month levelling regeneration bill suppose set mission may complete,0
every resource soften institutional feature use include motionpicture show concert extensive library pool table newspaper magazine really well place live many private home tax support,1
addition everpresent threat lockdown crush confidence consumer entrepreneur,1
department justice announce today federal criminal charge number defendant allege role dollar number million fraud scheme exploit federallyfunde child nutrition program covidnumber pandemic,0
many journalist try cling remnant professional standard,1
allow local authority issue another 500bn special bond suppose repay revenue infrastructure project finance,0
study back month work research datum collection rule class conduct team expose,0
well law mean every case interfere power government back public credit,0
recent event reinforce fundamental truth economic life,0
vučić say regret cite deepen security crisis neighbouring kosovo economic pressure among reason postpone europride happy time,0
write official line queen death strikingly respectful take lead vladimir putin message condolence,1
one day work every four belong government,1
title well receive argument echo variety paper innovate like china invest like china internationalise like china,0
already cost government absorb roughly onequarter total national income,0
modern city new form life really one science form individual helplessness rise social liability,1
may mean surrender first new occasion take back,1
pandemic politic two primary factor,1
I be just drown,0
big pharma company know ally democrats one easily figure lead,1
thoughtful proponent stakeholder capitalism argue friedman miss important point corporation exist state nature exist society permit,0
government ever want less governmentthat less,1
and I really mean impressive,1
absolutely not,0
rise cost government increase graft corruption evil relative sense diminish increase waste ratio probably fairly constant,0
whatever else may go conjecture evident itselfnamely rise cost government suddenly one generation traditional basis point begin absorb onequarter total national income political social oman great significance,1
part leftist war american value english language,0
someone have to,0
case spot far strain evade tecovirimat though rule class warn low barrier resistance pose risk resistant variant could emerge spread,0
banumber still predict overtake many place banumbernumber similar advantage plain banumber different outcome,0
us freight railroad worker push breaking point rail carrier profit ever strike avert early hour thursday morning table,1
add would surprised see new variant altogether fall,0
news medium repeat slogan inquire sincerely might mean ask might happen project vision,1
idea first present bid number exactly showcase europride country really need,0
federal expenditure much less rise cost government would suppose,0
let ask political social force act absorb national income purpose governmentacting increase taxation,1
yet evening tv political talk show whose host seem compete strident xenophobic next take different tack,1
there be many aspect of government,0
impulse select extensible form,0
another reason taxpayer entitle unctuous feeling presence social service,1
boss command support first beneficiary social service secondly promote live social service thirdly whose doctrine take give still machine,1
ask barry massey public information officer new mexico administrative office court explain bacon remark,0
freeway run south edge compton along east edge overall look pretty well serve freeway sit middle rectangle freeway,1
new mexico republicans denounce ruling,0
covid variant booster authorization come week brace next variant,1
panicked response political elite medium institution completely unfounded rail strike would indeed cause crisis supply chain general economy,1
country may outpace country economy year,0
bind war terrific extension government,1
stakeholder capitalism refersor least use referto idea company serve shareholder also societal interest,0
measure person immune system performance,0
growth advantage multiple country make reasonable think bfnumber gain foothold potentially transmissible parent banumber ray say,0
unanimous decision alldemocrat supreme court state new mexico come august number form new set rule govern admission bar pdf selfcontradictory clear report leftist scribe,1
therefore ideasany themthere two question first work,0
new variant evade vaccine actually harm people surface rule class need another lockdown panic unruly slave mass compliance fear,1
question extent politician especially catering somalis help enable,0
rail worker sick day limited amount pay time make job increasingly unsustainable kind family life,0
even economic writer time concede tory absolutely plan economic growth instead attempt extend mean renti capitalism protect extraction site build wish community tory donor continue produce poor quality unecological private home need tear couple decade collapse,1
crisis economic human welfare,0
little social service really spontaneous straight taxpayer heart,1
new york attorney general letitia james file lawsuit former president donald trump fraud,0
shtfplan accord report ndtv new covidnumber variant banumber account number percent recent case across us,0
citizen corporate chief tackle social issue say entrepreneur author,0
bad year afraid go happen next year,0
consider example olga skabeyeva one energetically toxic say government rossiyanumber channel,1
course bfnumber transmissible variant,0
many require single amino acid change fda say,0
finding chart show effectiveness covidnumber injection infection fall zero april number among child vaccinate november number,0
pride organiser remain defiant say serbian government lack legal authority cancel,0
consider kind state would much less decide want,1
aim always successful create economic growth across country intervene public health improve housing,0
although dveri negligible force national politic party win number percentage vote year election supermajority parliamentary seat hold rightleane party electoral incentive improve lgbtq right,0
misguide put focus hope onto one section work class ignore immense latent power logistic worker possess,1
secondly signal stalk market cloak privacy surround property come sale,0
conservative movement keep potentially divisive topic public school accelerate number produce law florida say gay bill ban teach critical race theory curriculum transparency bill require teacher post classroom material online,0
biden administration breathe perhaps temporary sigh relief pull stop avert strike,0
public credit nation different,0
part disrespect think put body front kid,0
they have no theory among they,1
reference state provide improve attorney license immigrant population daca recipients legal immigrant andor unauthorized immigrant massey say email,0
social fabric diverse democracy depend preserve certain space apolitical sanctuary especially divided body politic like,1
concerned next year admit,0
be this a warning of what to come,0
catch culture war recent poll number percent teacher say education become politicize teach,0
intent show unlike differently motivate force economic social political tend together swallow national income government also produce result intend,1
blunkett use phrase defend education spending basis would improve life low income student without level wealthier high achieve student,0
one parent accuse groom child run lgbt student club high school,0
hope congress see fit provide dollar number billion protect banking interest united states see necessity pass legislation protect old people,1
numerous alumnus blackrock esgpromote financial institution occupy senior role administration american president voice support stakeholder capitalism,0
suppose work tide rise save redeem able perform terrific gymnastic feat get back equilibrium,1
banker loath lend money investor reluctant buy bond,0
go day lead world recessionbuste,1
research find six state allow illegal practice law,0
kremlin squeeze independent medium coverage queen funeral demonstrate postmodern propaganda state compete  narrative entrepreneur  try make mark please boss,1
which district be hard hit,0
ndmp accord draft bill implement secretary state whim,1
marko mihailović numberyearold figurehead belgrade pride lead city win bid,0
use emergency power win war use fight depression,1
statement white house say administration act within limited funding increase supply athome covidnumber test strategic national stockpile sns purchase number million additional athome rapid test domestic manufacturer,0
think would like say,0
course suggestion continue mask get inject continue mask get booster,0
enlighten state run even high,0
author include zheng song chinese university hong kong try explain china distinctive pace pattern development,0
say corrupt government tend limit defeat,1
politicize climate teacher even find personal life fall great hostile scrutiny,0
fact white house say shortterm solution problem,0
political motive give many authority labourrun hardly tory  interest mayor pursue alternative agenda may work well challenge developer landlord fund conservative party,1
left deliberately obscure distinction illegal alien people immigrate lawfully united states,1
result monetary easing translate big expansion credit,0
time struggle make pandemic learning loss increase teacher  workload lead mount pressure increasingly antagonistic parent micromanage administrator,0
two half year disasterridden parliament however levellingup  remain sloganpolicy beyond small pot money seem heavily skewed towards tory marginal constituency,1
district reject mask requirement struggle enforce come work mean daily exposure covid,0
suit file civil suit however criminal charge may come well,0
isteve commenter bostex write inumber saint paul racist road,1
never know many  friend simply shrug happy state clue,0
intelligent uproar sense superficial probably delusive,1
strong consistent opposition lgbtq right serbia come dveri party hardright religious conservative often organise family value parade day belgrade pride form counterprot,0
fiscal swing like number percentage gdp two year number number,0
tax power many hand much less effective might,1
make read report indoctrinate policy wonk write difficult read write immigrant unclear actually mean lawfully present immigrant use word euphemism illegal alien,1
hate speech far prevalent call violence call use weapon prevent pride one even detain question let alone prosecute,0
face tight labor market many district raise base salary offer signing relocation bonus whopping dollar numbernumber one new mexico school district,0
railroad throw hand government demand public credit save bankruptcy radical force protest academic sense reason believe public ownership railroad see perhaps clearly use public credit tend bring experiment state ownership pass,1
proponent view include american economist milton friedman worry shift away shareholder primacy would make company less efficient less profitable leave society whole bad,0
nevertheless they be limited,0
white house aide work create contingency plan supply chain event strike,0
portion positive test around country forward agency genetic sequencing accord report cbs news,0
thing true crisis responsibility must pass government go far unawares toward experimental state know nothing experience almost nothing theory,1
anything possible time live,1
inumber boston kind racist road skirt roxbury cut terrible racist south boston south boston magic dirt make southie perfectly great live walk around number unlike roxbury access south boston beach bad know black people like swim,1
taxation meanwhile heavily increase much well long increase certainly field popular taxis thereby wealth redistribute downward capitalist society disbelieve way trouble,1
woke  capitalism emphasis,0
vaccination within month inject bad would take shot,0
want redistribute wealth want prey upon,1
thus national income absorb,0
plug budgetary hole number number city track southern weekly mainland newspaper increase amount collect fine last year,0
level bill really planning bill disguise something committee make clear beginning evidence session,1
propose agreement include good wage increase rail worker forty year,0
civil partnership give samesex couple right married one example remain nonexistent,0
despite talk postindustrial service economy getting around fact economy still function without industrial labour,1
indeed one main concern committee much bill vague unspecified cut power like provision secretary state put secondary legislation give bill substantive content future,0
late rule open border even court seem relish make arbitrary decision without think consequence,0
even case slow worldwide case global population approach number billion yet top numbernumber panic fearmongere continue,1
three claim make different highway right different part country,0
garina recall belgrade look like war zone,0
although leftwinger fond say conservative speak code former congressman charles rangel dny famously say tax cut racist dog whistle spic  n  anymore say let cut taxis leftist really speak code,1
momentum already build highly anticipate united parcel service contract fight summer number,0
analyze official government datum year find covidnumber vaccination take average number month kill inject,0
educator say teaching profession require training experience lower bar diminish quality classroom instruction child receive,0
way exchange freedom something elsefor security status refuge terror individual responsibility,1
this it will do by inflate money and credit,0
imperative reduce cost government measurethat make tax dollar buy,1
result typical taxis twenty year increase dollar number dollar number per capita public debt increase dollar number dollar number per capita,0
the explanation be simple,1
mr li repeatedly promise resort floodlike stimulus veiled reference past,0
letter number america ceos mr fink assert stakeholder capitalismis social ideological agenda,0
economic projection also predict unemployment rise number percent current level number percent end year,0
however mokdad warn biden administration projection remain feasible currently dominant variant omicron still remain contagious,0
large development site mews south kensington grant planning permission number doublebasement townhouse struggle attract interest buyer,0
official federal indictment number people number somalis,0
houston number teacher vacancy go school year compensate teacher district texas rural missouri switch fourday week,0
remote learn student  mental health deteriorate cause many act return school,0
etymology level  one distinguish properly neoliberal approach socialist  one use extended phrase level level  example david blunkett theresa may particular policy intervention,0
fight economic consequence overliquidation unjustified fear future united states,1
china like country ease monetary policy global financial crisis strike,0
president joe biden administration repeatedly unsuccessfully ask congress pandemic funding,0
lawyer officer court minimum lawbreaker,1
many economic historian believe help power industrial revolution,0
even global financial crisis number china gdp quickly catch would crisis never happen,0
vučić former farright radical become prime minister year moderate politic win support eu bigwig,1
see selective struggle take place within government,1
indeed criticism newspaper air generally aim either british government play politic  state funeral impromptu summit clumsily handle saudi chinese delegation americans,1
be it a myth,0
state levy upon corporation income state federal taxis together onefifth,0
stakeholder capitalism part broad worldview hold corporate leader play fundamental role determine implement society core value,1
reduce cost government measure tend serve potent force act extend government,0
increase intend combat high level inflation experience much world,0
seem like gear several different angle,1
increase wealth high standard living create demand public service know generation ago twenty year number new activity add responsibility government detroit highschool evening class child clinic childwelfare nurse transportation crippled class mental defective training library personnel testing gas testing material healtheducation nurse camp tubercular child publichealth education medical college college evening class college summer class employment bureau symphony concert cancer clinic cancer nurse human antiserum nurse cooperative high school use radio school,0
cdc closely track mutation virus watch potential variant could resistant monkeypox treatment,0
tax rate rise necessity national income shrink,0
yet everywhere deficit public revenue shrinkage everything taxable sudden violent,1
though journalist knowledge rail industry labour movement sound alarm month last day see mainstream medium outlet publish increasingly frantic article potential strike,0
mihailović fellow organiser see europride number chance take event back political root remind participant across europe pride merely opportunity party,0
what relief do the taxpayer imagine,1
former president face many legal struggle include maralago property search fbi involvement jan number insurrection investigate house select committee,0
never let good crisis go waste right,1
black tend live near center city neighborhood tend get chop,0
politician come forward back,0
give combative willingness rankandfile rail worker vote contract recently simply assume worker vote favour accept agreement,1
we take that for grant,0
course illegal alien definition guilty unlawful conduct hard imagine go daily business without commit act involve dishonesty fraud deceit misrepresentation,1
need legal system work serbia rule law observe say,0
nearly everywhere teacher morale plummet number percent poll january say suffer burnout,0
large number influential farright movement vocal opposition europride recent month may lead vučić cancel event,0
year party lobby parliamentary vote ban pride fail organise protest,0
even regular television news matter fact show footage mass respectful mourner choreographed pageantry human moment sorrow,0
clear steer kremlin different medium outlet still present different perspective operate increasingly dangerous environment one outlet close editor sack journalist imprison even kill step line,0
